uuid,title,snippet,url
f23c066c-74fb-46ce-8f5f-be617757acd2,Invesco KBW Bank ETF declares quarterly distribution of $0.3870 (NASDAQ:KBWB),"To ensure this doesn’t happen in the future, please enable Javascript and cookies in your browser.

If you have an ad-blocker enabled you may be blocked from ...",https://seekingalpha.com/news/4048512-invesco-kbw-bank-etf-declares-quarterly-distribution-of-03870
ae2267dc-a8f9-4fdf-adf5-1b67f95c9fb0,Invesco Global Water ETF declares quarterly distribution of $0.0835 (NASDAQ:PIO),"To ensure this doesn’t happen in the future, please enable Javascript and cookies in your browser.

If you have an ad-blocker enabled you may be blocked from ...",https://seekingalpha.com/news/4048510-invesco-global-water-etf-declares-quarterly-distribution-of-00835
dea77a32-cc5f-48f4-9735-d6ae23d17c1d,16 Most Promising QQQ Stocks According to Hedge Funds,"In this article, we will take a look at the 16 most promising QQQ stocks according to hedge funds. To skip our analysis of the recent trends, and market activit...",https://finance.yahoo.com/news/16-most-promising-qqq-stocks-145940327.html?.tsrc=rss
